{"apiVersion":"bugate.io/v2","id":"binding-same-task","kind":"ProtocolBinding","methods":["acceptance_scope","business_understanding","diagnosis","execution","implementation","knowledge","test_design","testability"],"profile":{"digest":"sha256:03c89e6c060bd9ab2d483b10c44d5c4ba0d410c4a6a84fed651ad1d306ba7731","id":"neutral-profile","version":"1"},"protocol":{"digest":"sha256:be1bcf919c65ca07efdc6f0461416390b19c3287d8cb0427165baf62ef3ed444","id":"bugate","version":"2.1.0-dev.1"},"resolved_from":".bugate/protocol.lock.json","workspace_id":"sha256:cdfdb32e721f3faffef5ba403eebe28f0a19a1fb81d2b00dd530e8962c65c9e2"}
